{
  "fingerprint_version": "openbot.dataset_repair_plan.fingerprint.v1",
  "plan_fingerprint": "3eb070224ca695dcb310f36ab340c02528a3d7b8b4fefbdab8a2e8ddb8b7a397",
  "safety": {
    "atomic_destination_visibility": true,
    "copy_on_write_required": true,
    "payload_edits_forbidden": true,
    "planning_read_only": true,
    "source_fingerprint_required": true,
    "unknown_fields_preserved": true
  },
  "schema_version": "openbot.dataset_repair_plan.v1",
  "snapshot_options": {
    "checksum": "sha256",
    "follow_symlinks": false,
    "input_format": "lerobot",
    "integrity": "full"
  },
  "source": {
    "adapter": "lerobot_v30",
    "dataset_format_version": "v3.0",
    "expected_output_tree_sha256": "40569135467c47114a80db7adda09ed6e5b938d3504fb3bd3bf75c1233686e5a",
    "input_format": "lerobot",
    "snapshot_fingerprint": "c123ec8d670fb4386a3da71e8db77552e77963cb3b30e99b9514fefc51103de7",
    "tree_sha256": "f245f43f334e8ba9b78b046ceb1ee512dbed5b20308b68ea1fa33b1c1869b646"
  },
  "source_audit": {
    "coverage": {
      "capabilities": [
        {
          "capability": "advisory.measurements",
          "checked": 1,
          "integrity": "full",
          "omitted": [],
          "selected": [
            "data/chunk-000/file-000.parquet"
          ],
          "status": "complete",
          "total": 1
        },
        {
          "capability": "alignment.data_relations",
          "checked": 1,
          "integrity": "full",
          "omitted": [],
          "selected": [],
          "status": "complete",
          "total": 1
        },
        {
          "capability": "alignment.episode_ranges",
          "checked": 1,
          "integrity": "full",
          "omitted": [],
          "selected": [],
          "status": "complete",
          "total": 1
        },
        {
          "capability": "alignment.task_foreign_keys",
          "checked": 1,
          "integrity": "full",
          "omitted": [],
          "selected": [
            "data/chunk-000/file-000.parquet"
          ],
          "status": "complete",
          "total": 1
        },
        {
          "capability": "alignment.timestamps",
          "checked": 1,
          "integrity": "full",
          "omitted": [],
          "selected": [
            "data/chunk-000/file-000.parquet"
          ],
          "status": "complete",
          "total": 1
        },
        {
          "capability": "alignment.video_relations",
          "checked": 0,
          "integrity": "full",
          "omitted": [],
          "selected": [],
          "status": "complete",
          "total": 0
        },
        {
          "capability": "content.checksum",
          "checked": 0,
          "integrity": "full",
          "omitted": [],
          "selected": [],
          "status": "complete",
          "total": 0
        },
        {
          "capability": "data.indexes",
          "checked": 1,
          "integrity": "full",
          "omitted": [],
          "selected": [
            "data/chunk-000/file-000.parquet"
          ],
          "status": "complete",
          "total": 1
        },
        {
          "capability": "data.inventory",
          "checked": 1,
          "integrity": "full",
          "omitted": [],
          "selected": [],
          "status": "complete",
          "total": 1
        },
        {
          "capability": "data.parquet_footer",
          "checked": 1,
          "integrity": "full",
          "omitted": [],
          "selected": [
            "data/chunk-000/file-000.parquet"
          ],
          "status": "complete",
          "total": 1
        },
        {
          "capability": "data.parquet_rows",
          "checked": 1,
          "integrity": "full",
          "omitted": [],
          "selected": [
            "data/chunk-000/file-000.parquet"
          ],
          "status": "complete",
          "total": 1
        },
        {
          "capability": "data.parquet_schema",
          "checked": 1,
          "integrity": "full",
          "omitted": [],
          "selected": [
            "data/chunk-000/file-000.parquet"
          ],
          "status": "complete",
          "total": 1
        },
        {
          "capability": "format.contract",
          "checked": 1,
          "integrity": "full",
          "omitted": [],
          "selected": [],
          "status": "complete",
          "total": 1
        },
        {
          "capability": "media.declared_contract",
          "checked": 0,
          "integrity": "full",
          "omitted": [],
          "selected": [],
          "status": "complete",
          "total": 0
        },
        {
          "capability": "media.decode",
          "checked": 0,
          "integrity": "full",
          "omitted": [],
          "selected": [],
          "status": "complete",
          "total": 0
        },
        {
          "capability": "media.inventory",
          "checked": 0,
          "integrity": "full",
          "omitted": [],
          "selected": [],
          "status": "complete",
          "total": 0
        },
        {
          "capability": "media.metadata",
          "checked": 0,
          "integrity": "full",
          "omitted": [],
          "selected": [],
          "status": "complete",
          "total": 0
        },
        {
          "capability": "metadata.episode_indexes",
          "checked": 1,
          "integrity": "full",
          "omitted": [],
          "selected": [
            "meta/episodes/chunk-000/file-000.parquet"
          ],
          "status": "complete",
          "total": 1
        },
        {
          "capability": "metadata.episodes",
          "checked": 1,
          "integrity": "full",
          "omitted": [],
          "selected": [],
          "status": "complete",
          "total": 1
        },
        {
          "capability": "metadata.info",
          "checked": 1,
          "integrity": "full",
          "omitted": [],
          "selected": [],
          "status": "complete",
          "total": 1
        },
        {
          "capability": "metadata.stats",
          "checked": 0,
          "integrity": "full",
          "omitted": [],
          "reason": "Optional file missing.",
          "reason_code": "optional_file_missing",
          "selected": [],
          "status": "unavailable",
          "total": 1
        },
        {
          "capability": "metadata.tasks",
          "checked": 1,
          "integrity": "full",
          "omitted": [],
          "selected": [],
          "status": "complete",
          "total": 1
        },
        {
          "capability": "metadata.totals",
          "checked": 1,
          "integrity": "full",
          "omitted": [],
          "selected": [
            "meta/info.json"
          ],
          "status": "complete",
          "total": 1
        },
        {
          "capability": "source.identity",
          "checked": 1,
          "integrity": "full",
          "omitted": [],
          "selected": [],
          "status": "complete",
          "total": 1
        },
        {
          "capability": "stats.recomputed",
          "checked": 2,
          "integrity": "full",
          "omitted": [],
          "reason": "Statistics were recomputed but no stored values exist to compare.",
          "reason_code": "stored_stats_unavailable",
          "selected": [
            "action",
            "observation.state"
          ],
          "status": "partial",
          "total": 2
        },
        {
          "capability": "stats.stored",
          "checked": 0,
          "integrity": "full",
          "omitted": [
            "meta/stats.json"
          ],
          "reason": "Optional normalization statistics are absent.",
          "reason_code": "optional_file_missing",
          "selected": [],
          "status": "unavailable",
          "total": 1
        }
      ]
    },
    "findings": [
      {
        "code": "LEROBOT_STATS_MISSING",
        "evidence": {
          "required_by_base_loader": false
        },
        "fixability": "manual",
        "impact": "normalization_contract_is_unverified",
        "layer": "metadata",
        "location": {},
        "message": "Optional normalization statistics are missing.",
        "path": "meta/stats.json",
        "remediation_ref": "openbot://remediation/LEROBOT_STATS_MISSING",
        "rule_id": "lerobot.stats.missing",
        "severity": "warning"
      },
      {
        "code": "LEROBOT_FRAME_COUNT_MISMATCH",
        "evidence": {
          "declared": 99,
          "discovered": 2,
          "method": "count_all_parquet_rows"
        },
        "fixability": "delegated",
        "impact": "declared_frame_extent_is_stale",
        "layer": "alignment",
        "location": {
          "json_pointer": "/total_frames"
        },
        "message": "Declared frame total differs from full Parquet row count.",
        "path": "meta/info.json",
        "remediation_ref": "openbot://remediation/LEROBOT_FRAME_COUNT_MISMATCH",
        "rule_id": "lerobot.frame.count.mismatch",
        "severity": "error"
      },
      {
        "code": "LEROBOT_FRAME_COUNT_MISMATCH",
        "evidence": {
          "declared": 99,
          "discovered": 2,
          "method": "sum_episode_lengths"
        },
        "fixability": "delegated",
        "impact": "declared_frame_extent_is_stale",
        "layer": "alignment",
        "location": {
          "json_pointer": "/total_frames"
        },
        "message": "Declared frame total differs from episode metadata.",
        "path": "meta/info.json",
        "remediation_ref": "openbot://remediation/LEROBOT_FRAME_COUNT_MISMATCH",
        "rule_id": "lerobot.frame.count.mismatch",
        "severity": "error"
      }
    ],
    "input_format": "lerobot",
    "rule_pack_version": "openbot.dataset_audit.rules.v1",
    "schema_version": "openbot.dataset_audit.v1",
    "skipped_checks": [],
    "summary": {
      "error": 2,